{
  "$schema": "https://json-schema.org/draft/2020-12/schema",
  "$id": "ImageLabels.schema.json",
  "title": "ImageLabels",
  "description": "영역 이미지의 라벨 (docker inspect .Config.Labels). 영역(빌드 쪽)이 이미지에 붙이고 deploy(build-images.sh, publish-image(s).sh 가 게시 전에 이 스키마로 검증하고, e2e.sh, demo.sh, check_versions.py 가 읽는다). 라벨 값은 문자열이다. 필수는 publish-image.sh 가 실제로 보던 4개(service, revision, contracts.boundary, contracts.survey-schema)이고, turn-engine·model-runtime·langgraph 는 해당 서비스에만 단다(선택). 값이 없다는 표기는 `n/a` 하나다(`none`·`unset`·`unknown` 불가). revision 은 소스 커밋(hex)이라 `unknown` 은 거부된다. 서비스별 추가 제약(예: survey-service 는 langgraph 필수, service 상수)은 영역이 `allOf` 프로필로 더한다. io.openit.* 키는 아래 집합만 허용한다: 오타(`io.openit.revison`)가 조용히 무시되면 게시 검사는 통과하는데 deploy 가 revision 을 못 읽는다. io.openit.* 가 아닌 라벨(org.opencontainers.* 등)은 무시한다(베이스 이미지가 붙인다).",
  "type": "object",
  "properties": {
    "io.openit.service": {
      "type": "string",
      "pattern": "^[a-z][a-z0-9-]*$",
      "description": "서비스(이미지) 이름"
    },
    "io.openit.revision": {
      "type": "string",
      "pattern": "^[0-9a-f]{7,40}$",
      "description": "소스 커밋. 'unknown' 불가"
    },
    "io.openit.contracts.boundary": {
      "type": "string",
      "pattern": "^v[0-9]+\\.[0-9]+\\.[0-9]+$",
      "description": "소비하는 boundary-contracts 태그(v 접두사 포함)"
    },
    "io.openit.contracts.survey-schema": {
      "type": "string",
      "pattern": "^([0-9]+|n/a)$",
      "description": "문진 스키마 패키지(openit-survey-schema) 버전의 주 번호(예: survey-schema-v2.0.0 → \"2\"). 이미지에 실제로 들어간 패키지의 버전에서 찍는다(U50). 문진 스키마의 정수 CONTRACT_VERSION(모델 런타임 호환 번호, survey-service ADR-0044)이 아니다. deploy는 기준표 태그의 주 번호와 비교한다. 쓰지 않는 영역은 n/a"
    },
    "io.openit.model-runtime": {
      "type": "string",
      "pattern": "^(v[0-9]+\\.[0-9]+\\.[0-9]+|n/a)$",
      "description": "model-runtime 을 쓰는 서비스만. 쓰지 않으면 라벨을 달지 않거나 n/a. v 접두사 포함"
    },
    "io.openit.variant": {
      "type": "string",
      "pattern": "^[a-z][a-z0-9-]*$"
    },
    "io.openit.app-version": {
      "type": "string",
      "minLength": 1
    },
    "io.openit.langgraph": {
      "type": "string",
      "minLength": 1,
      "description": "langgraph 를 쓰는 서비스(survey-service)만. 필수로 만드는 것은 영역의 프로필 몫"
    },
    "io.openit.jobs": {
      "type": "string",
      "contentMediaType": "application/json",
      "contentSchema": {
        "$ref": "JobsDeclaration.schema.json"
      },
      "description": "영역이 내는 잡 선언(JSON 문자열). 없으면 잡 없음"
    },
    "io.openit.exposure": {
      "type": "string",
      "contentMediaType": "application/json",
      "contentSchema": {
        "$ref": "Exposure.schema.json"
      },
      "description": "게이트웨이 노출 선언(JSON 문자열)"
    }
  },
  "required": [
    "io.openit.service",
    "io.openit.revision",
    "io.openit.contracts.boundary",
    "io.openit.contracts.survey-schema"
  ],
  "propertyNames": {
    "not": {
      "pattern": "^io\\.openit\\.(?!(service|revision|contracts\\.boundary|contracts\\.survey-schema|model-runtime|variant|app-version|langgraph|jobs|exposure)$)"
    }
  }
}