{
  "io.openit.contracts.boundary": "v2.1.1",
  "io.openit.contracts.survey-schema": "1",
  "io.openit.langgraph": "1.2.15",
  "io.openit.model-runtime": "v0.7.6",
  "io.openit.revision": "85b3552",
  "io.openit.service": "survey-service",
  "io.openit.jobs": "{\"jobs\": [{\"name\": \"survey-purge\", \"argv\": [\"python\", \"-m\", \"survey_service\", \"purge\"], \"idempotent\": true, \"secret_files\": [\"SURVEY_DATABASE_URL_FILE\"], \"needs\": [\"postgres\"]}]}",
  "io.openit.exposure": "{\"service\": \"survey-service\", \"routes\": [{\"paths\": [\"/v1/sessions\", \"/v1/sessions/*\"], \"auth\": {\"kind\": \"device-token\"}, \"user_header\": \"strip\", \"timeouts_ms\": {\"dial\": 1000, \"response_header\": 8500}}, {\"paths\": [\"/v1/staff/*\", \"/v1/sessions/*/intervention\"], \"methods\": [], \"auth\": {\"kind\": \"account\", \"roles\": [\"staff\"]}, \"upstream_token\": \"survey-api-staff\", \"user_header\": \"set\", \"streaming\": true, \"timeouts_ms\": {\"dial\": 2000, \"response_header\": 10000, \"read\": 3600000}}, {\"paths\": [\"/v1/sessions/*/risk-signals\", \"/v1/results\", \"/v1/results/*\"], \"auth\": {\"kind\": \"denied\"}}]}"
}
